{
  "$schema": "http://json-schema.org/draft-06/schema",
  "type": "object",
  "properties": {
    "version": {
      "type": "number"
    },
    "success": {
      "type": "boolean"
    },
    "reason": {},
    "content": {
      "type": "object",
      "properties": {
        "status": {
          "type": "string"
        },
        "message": {
          "type": "string"
        },
        "data": {
          "type": "object",
          "properties": {
            "api_request_id": {
              "type": "string"
            }
          }
        }
      }
    },
    "raw": {},
    "inputs": {
      "type": "object",
      "properties": {
        "trusteer_ppd_session_id": {
          "type": "string"
        },
        "trusteer_ppd_feedback": {
          "type": "string"
        },
        "trusteer_ppd_application_id": {
          "type": "string"
        },
        "trusteer_ppd_fraud_mo": {}
      }
    },
    "metrics": {
      "type": "object",
      "properties": {
        "version": {
          "type": "string"
        },
        "package": {
          "type": "string"
        },
        "package_version": {
          "type": "string"
        },
        "host": {
          "type": "string"
        },
        "execution_time_ms": {
          "type": "integer"
        },
        "timestamp": {
          "type": "string"
        }
      }
    }
  }
}