{
  "version": 2.0,
  "success": true,
  "reason": null,
  "content": {
    "status": "success",
    "message": "OK",
    "data": {
      "api_request_id": "82825B58-70CA-4B04-9BD2-E65E112AA417"
    }
  },
  "raw": null,
  "inputs": {
    "trusteer_ppd_session_id": "eaa3aef168e8aeadfb606bf2637c21f",
    "trusteer_ppd_feedback": "pending_confirmation",
    "trusteer_ppd_application_id": "demo_app",
    "trusteer_ppd_fraud_mo": null
  },
  "metrics": {
    "version": "1.0",
    "package": "fn-trusteer-ppd",
    "package_version": "1.0.0",
    "host": "laptop.local",
    "execution_time_ms": 3517,
    "timestamp": "2023-02-28 16:57:36"
  }
}